[
  {
    "id": "partner_atrocity",
    "title": "Partner-Force Atrocity",
    "text": "A unit you raided alongside executed detainees. Your flag is on it — and the press doesn't have it yet.",
    "weight": 1.2,
    "requires": {
      "min_partner_capacity": 1
    },
    "choices": [
      {
        "label": "Disclose it",
        "effects": [
          {
            "op": "domestic_legitimacy",
            "delta": -4
          },
          {
            "op": "international_legitimacy",
            "delta": -1
          },
          {
            "op": "local_legitimacy",
            "delta": -2
          }
        ]
      },
      {
        "label": "Bury the report",
        "effects": [
          {
            "op": "local_legitimacy",
            "delta": -4
          },
          {
            "op": "grievance",
            "delta": 3
          }
        ]
      }
    ],
    "notes": "Transparency Dial prototype. At v0.6 the suppress branch starts a leak clock instead of paying immediately; until then the cover-up costs where the population already knows.",
    "sources": [
      "Sahel partner-force abuse reporting",
      "DESIGN §6 Transparency Dial"
    ]
  },
  {
    "id": "refugee_wave",
    "title": "Refugee Wave",
    "text": "Displacement crosses a threshold. Columns move toward the capital and the borders; the cameras are already there.",
    "weight": 1.0,
    "requires": {
      "min_avg_grievance": 55
    },
    "choices": [
      {
        "label": "Host humanitarian corridors",
        "effects": [
          {
            "op": "international_legitimacy",
            "delta": 3
          },
          {
            "op": "domestic_legitimacy",
            "delta": -2
          }
        ]
      },
      {
        "label": "Push the host to seal the border",
        "effects": [
          {
            "op": "international_legitimacy",
            "delta": -4
          },
          {
            "op": "domestic_legitimacy",
            "delta": 2
          },
          {
            "op": "grievance",
            "delta": 3
          }
        ]
      }
    ],
    "notes": "The Local → International → Domestic cascade (DESIGN §10).",
    "sources": [
      "UNHCR Sahel displacement record"
    ]
  },
  {
    "id": "base_access_revoked",
    "title": "Base Access Revoked",
    "text": "The junta, flanked by new foreign advisors, gives your forces weeks to leave.",
    "weight": 1.5,
    "requires": {
      "any_junta": true
    },
    "choices": [
      {
        "label": "Withdraw in good order",
        "effects": [
          {
            "op": "international_legitimacy",
            "delta": 1
          },
          {
            "op": "domestic_legitimacy",
            "delta": -2
          },
          {
            "op": "partner_capacity",
            "delta": -3
          }
        ]
      },
      {
        "label": "Pay to stay — drop conditions",
        "effects": [
          {
            "op": "international_legitimacy",
            "delta": -5
          },
          {
            "op": "domestic_legitimacy",
            "delta": -1
          }
        ]
      }
    ],
    "notes": "The Mali-expels-France beat (DESIGN §8). The full allegiance market lands v0.7.",
    "sources": [
      "2022 French withdrawal from Mali record"
    ]
  },
  {
    "id": "election_shock",
    "title": "Election Shock at Home",
    "text": "Coffin counts lead the news a third night running. The opposition has one issue now, and it is your war.",
    "weight": 0.8,
    "requires": {
      "min_casualties": 5
    },
    "choices": [
      {
        "label": "Defend the mission",
        "effects": [
          {
            "op": "domestic_legitimacy",
            "delta": -5
          }
        ]
      },
      {
        "label": "Pivot to homeland security",
        "effects": [
          {
            "op": "domestic_legitimacy",
            "delta": -2
          },
          {
            "op": "international_legitimacy",
            "delta": -2
          }
        ]
      }
    ],
    "notes": "Merom's thesis arriving on schedule: the war is lost or saved at home (DESIGN §1).",
    "sources": [
      "Merom, How Democracies Lose Small Wars"
    ]
  },
  {
    "id": "transitional_council",
    "title": "A 'Transitional Council' Announces Itself",
    "text": "Officers your trainers certified seize state TV at dawn, citing the failing war — and thank their foreign partners, vaguely.",
    "weight": 1.5,
    "requires": {
      "min_coup_risk": 0.4
    },
    "choices": [
      {
        "label": "Acquiesce — stability first",
        "effects": [
          {
            "op": "coup_seed",
            "delta": 0.3
          },
          {
            "op": "international_legitimacy",
            "delta": -4
          }
        ]
      },
      {
        "label": "Condemn, suspend aid",
        "effects": [
          {
            "op": "coup_seed",
            "delta": 0.1
          },
          {
            "op": "partner_capacity",
            "delta": -2
          },
          {
            "op": "domestic_legitimacy",
            "delta": -1
          }
        ]
      }
    ],
    "notes": "The train-and-equip blowback made visible. The collapse roll itself fires in resolution substep f (DESIGN §18.3).",
    "sources": [
      "Sahel coup-leader training records"
    ]
  },
  {
    "id": "quiet_sector_report",
    "title": "The Quiet Sector",
    "text": "A barely-covered sector's attack counts have fallen two quarters running. Your briefer calls it progress; a footnote notes new village 'dispute committees', author unknown.",
    "weight": 0.7,
    "choices": [
      {
        "label": "Declare progress",
        "effects": [
          {
            "op": "domestic_legitimacy",
            "delta": 3
          },
          {
            "op": "intel",
            "delta": -0.1,
            "turns": 4
          }
        ]
      },
      {
        "label": "Commission an assessment",
        "effects": [
          {
            "op": "intel",
            "delta": 0.15,
            "turns": 4
          },
          {
            "op": "domestic_legitimacy",
            "delta": -1
          }
        ]
      }
    ],
    "notes": "Pillar 4 as an event: quiet is not peace. Declaring progress relaxes collection exactly where entrenchment is doing its work.",
    "sources": [
      "2026 Sahel entrenchment analyses — falling attacks ≠ security"
    ]
  }
]